paper,model,humidity_parameter_method,humidity_parameter_reason,humidity_parameter_decision,temperature_parameter_method,temperature_parameter_reason,temperature_parameter_decision,time_parameter_method,time_parameter_reason,time_parameter_decision,humidity_temporal_reason,humidity_temporal_decision,temperature_temporal_reason,temperature_temporal_decision,PM_temporal_reason,PM_temporal_decision
braga,generalized additive Poisson regression,LOESS,to minimize Akaike's Information Criteria,NA,LOESS,to minimize Akaike's Information Criteria,NA,LOESS,to eliminate seasonal patterns in the residuals and reduce residuals to white noise,NA,NA,NA,NA,NA,NA,NA
katsouyanni,generalized additive models,LOESS,to minimize Akaike's Information Criterion,NA,LOESS,to minimize Akaike's Information Criterion,NA,LOESS,to minimize Akaike's Information Criterion,NA,NA,same day and lags up to 2 days or averaged over 0-2 days,NA,same day and lags up to 2 days or averaged over 0-2 days,NA,NA
ostro,Poisson regression,smoothing spline,NA,3,smoothing spline,NA,3,smoothing spline,"@samet2000fine , spike in mortality during Dec 1999","7  per year , 3 knots for 3-week period",NA,1-day lag,NA,1-day lag,previous studies reported stronger associations with lagged or cumulative exposures,2-day average of lag 0 and 1 (lag 01) and single-day lag of 2 days (lag 2)
peel,Poisson generalized estimating equations,NA,NA,NA,natural spline,NA,at 25th and 75th percentiles,natural spline,NA,monthly knots,NA,NA,NA,"lags 0, 1, and 2",NA,"lags 0, 1, and 2 days"
schwartz,Poisson regression,NA,NA,NA,LOESS,expected dose-response relationship to be much smoother,50% of data,LOESS,to ensure removal of all long wavelength patterns from the data,5% of data (about 100 days),NA,NA,NA,NA,based on previous observations,mean of non-missing concentrations on same and previous day
zanobetti,generalized additive model,LOESS,to minimize Akaike's Information Criterion,NA,LOESS,to minimize Akaike's Information Criterion,NA,LOESS,to minimize the sum of the autocorrelation of the residuals,NA,NA,previous day or up to 3 previous days or average of a few days,NA,previous day or up to 3 previous days or average of a few days,NA,NA
